sku,name,description,unitOfMeasure,isCritical,category_L1,category_L2,category_L3,category_L4
,SalesHive CRM,"A powerful all-in-one platform designed to streamline sales processes, enhance customer engagement, and boost productivity for businesses of all sizes.",KG,False,Indirect Services and Materials,Marketing & Sales,Sales Support,Customer Relationship Management (CRM) Tools
,OptiView X1,A high-resolution projector designed to enhance your home theater experience and professional presentations.,KG,False,Indirect Services and Materials,IT & Technology,Hardware,"Audio/Visual Equipment (Projectors, Conferencing Systems)"
,PatentPro Advisor,"A comprehensive software solution designed to assist inventors and businesses in navigating patent applications, legal compliance, and intellectual property protection strategies.",KG,False,Indirect Services and Materials,Corporate & Professional Services,Legal Services,Intellectual Property & Patents
,UberGo,Affordable rides tailored for short trips in bustling city centers.,Box,True,Indirect Services and Materials,Corporate Travel,Transportation,Taxi & Ride-Sharing Services
,Employee Engagement Rewards,Boost morale and productivity through personalized rewards and recognition programs tailored to individual employee preferences.,Set,False,Indirect Services and Materials,Marketing & Sales,Sales Support,Sales Incentive & Reward Programs
,SalesForce Pro,A robust CRM platform designed to streamline sales processes and enhance customer relationships.,Set,False,Indirect Services and Materials,Marketing & Sales,Sales Support,Customer Relationship Management (CRM) Tools
,SecureGuard Elite,A premier manned guarding service providing round-the-clock protection and security solutions.,KG,False,Indirect Services and Materials,Facility Services,Security Services,Manned Guarding
,FlexDrive Lease,"A flexible vehicle leasing program offering monthly payments without long-term commitments, perfect for those who need a car temporarily.",Piece,False,Indirect Services and Materials,Logistics,Fleet Management,Vehicle Leasing & Purchase
,Eco-Friendly Water Bottle,A stylish and sustainable water bottle perfect for promoting your brand while encouraging environmental responsibility.,Set,False,Indirect Services and Materials,Marketing & Sales,Events & Promotions,Promotional Goods & Branded Merchandise
,SpenderTrack Pro,"A comprehensive expense management software designed to simplify tracking, categorizing, and reporting business expenses.",Box,False,Indirect Services and Materials,Corporate Travel,Travel Management Services,Expense Management Software
,DataInsight Pro,A powerful business intelligence tool that transforms complex data into actionable insights through advanced analytics and interactive visualization.,Set,False,Indirect Services and Materials,IT & Technology,Software,"Business Intelligence & Analytics (BI, Data Visualization)"
,InsightFlow Pro,A powerful Business Intelligence and analytics platform designed to transform complex data into actionable insights.,Set,False,Indirect Services and Materials,IT & Technology,Software,"Business Intelligence & Analytics (BI, Data Visualization)"
,SecureVault Storage Solutions,Offering state-of-the-art climate-controlled units and advanced security features to ensure your stored items remain safe and protected.,Piece,False,Indirect Services and Materials,Logistics,Warehousing & Distribution,Warehouse Rental & Storage
,SalesConnect Pro,"An intuitive CRM tool designed to streamline sales processes and enhance customer interactions, boosting your team's productivity.",Piece,False,Indirect Services and Materials,Marketing & Sales,Sales Support,Customer Relationship Management (CRM) Tools
,Eclipse Pro Laptop,A powerful and sleek laptop designed to meet all your computing needs with high performance.,Box,False,Indirect Services and Materials,IT & Technology,Hardware,"End-User Computing (Laptops, Desktops, Monitors)"
,SyncStream Pro,A robust productivity suite that streamlines email management and enhances collaboration among teams.,Piece,True,Indirect Services and Materials,IT & Technology,Software,"Productivity & Collaboration Suites (Office, Email)"
,The Event Coordinator Pro,A comprehensive software solution that simplifies event planning and management processes.,Piece,False,Indirect Services and Materials,Marketing & Sales,Events & Promotions,Event Management & Production
,ExpressDelivery Pro,A premium parcel service offering fast and reliable delivery across all major cities.,Set,True,Indirect Services and Materials,Logistics,Transportation & Freight,Parcel & Courier Services
,SecureVault Savings Account,A high-yield savings account designed to keep your money safe and grow through competitive interest rates.,KG,True,Indirect Services and Materials,Corporate & Professional Services,Financial Services,Banking & Treasury Services
,SecureStorage Solutions,State-of-the-art warehouse rental offering climate-controlled storage units and flexible leasing options to protect your valuable inventory.,Box,False,Indirect Services and Materials,Logistics,Warehousing & Distribution,Warehouse Rental & Storage
,Premium Print Solutions,"Top-quality print services including high-resolution copies, professional document formatting, and eco-friendly options.",Set,False,Indirect Services and Materials,Facility Services,Office Supplies & Services,Print & Copy Services
,The Event Maven,"A comprehensive suite of tools designed to streamline event planning and execution for flawless, memorable experiences.",Set,True,Indirect Services and Materials,Marketing & Sales,Events & Promotions,Event Management & Production
,Legal Compliance Suite,A comprehensive software solution designed to streamline compliance processes for corporations and businesses.,Set,False,Indirect Services and Materials,Corporate & Professional Services,Legal Services,Corporate & Commercial Law
,Mastering Sales Conversations,An interactive course designed to enhance your sales skills through real-life scenarios and practical techniques.,Piece,False,Indirect Services and Materials,Marketing & Sales,Sales Support,Sales Training
,GreenPath Solutions,A leading environmental consulting firm specializing in sustainable business practices and eco-friendly solutions.,Box,False,Indirect Services and Materials,Corporate & Professional Services,Consulting,Environmental & Sustainability Consulting
,TechEdge Solutions,Comprehensive IT consulting services to optimize your business operations and infrastructure.,Box,True,Indirect Services and Materials,IT & Technology,IT Services & Telecom,IT Consulting & Implementation
,Achieve Rewards Program,An innovative sales incentive program designed to motivate and reward top-performing employees for exceptional achievements.,KG,True,Indirect Services and Materials,Marketing & Sales,Sales Support,Sales Incentive & Reward Programs
,SecureGuard Pro,"A state-of-the-art access control system that ensures only authorized personnel can enter restricted areas, enhancing security and compliance.",Piece,False,Indirect Services and Materials,Facility Services,Security Services,Access Control Systems
,NovaPixel X1,A sleek and powerful laptop designed for ultimate performance and portability.,Set,False,Indirect Services and Materials,IT & Technology,Hardware,"End-User Computing (Laptops, Desktops, Monitors)"
,SecureGuard Pro,"A comprehensive cybersecurity service offering advanced penetration testing, real-time monitoring, and a robust Security Operations Center to protect your digital assets.",Box,False,Indirect Services and Materials,IT & Technology,IT Services & Telecom,"Cybersecurity Services (Pen Testing, Monitoring, SOC)"
,SocialBuzz Pro,A comprehensive toolset designed to enhance influencer collaborations and social media marketing strategies for businesses of all sizes.,Box,False,Indirect Services and Materials,Marketing & Sales,Marketing & Advertising,Influencer & Social Media Marketing
,Wellness Hub,"A comprehensive employee wellness platform offering resources for mental health, fitness, nutrition, and personal development.",Set,False,Indirect Services and Materials,Corporate & Professional Services,Human Resources Services,Employee Welfare & Assistance Programs
,EcoClean Pro,A high-performance cleaning service offering eco-friendly solutions that effectively remove dirt and grime while prioritizing environmental sustainability.,KG,False,Indirect Services and Materials,Facility Services,Facility Management,Janitorial & Cleaning Services
,Express Trucking Solutions,Efficient road freight services tailored to your business needs.,Set,False,Indirect Services and Materials,Logistics,Transportation & Freight,"Road Freight (FTL, LTL)"
,Brand Alliance Partner Program,Secure strategic partnerships that amplify your brand's reach and influence across key markets.,KG,True,Indirect Services and Materials,Marketing & Sales,Marketing & Advertising,Sponsorships & Partnerships
,CloudSphere Managed Services,"A comprehensive suite of IaaS, PaaS, and SaaS solutions designed to optimize your cloud infrastructure for seamless scalability and enhanced security.",Set,False,Indirect Services and Materials,IT & Technology,IT Services & Telecom,"Cloud & Hosting (IaaS, PaaS, SaaS)"
,ProHeat Insulation Solutions,Enhance energy efficiency and comfort in your building with our top-quality insulation products designed for optimal performance.,Piece,False,Indirect Services and Materials,Facility Services,Facility Management,Building Maintenance & HVAC
,Premium Gel Ink Pens Set,"High-quality gel ink pens perfect for writing and drawing, featuring vibrant colors and smooth flow.",KG,False,Indirect Services and Materials,Facility Services,Office Supplies & Services,Stationery & Consumables
,SecureVault Pro,A robust security software solution designed to protect sensitive data and ensure compliance with industry regulations.,Piece,False,Indirect Services and Materials,IT & Technology,Software,Security & Compliance Software
,Compliance Assurance Solutions,A comprehensive suite of services to ensure your organization meets all regulatory requirements and optimizes tax efficiency.,Piece,False,Indirect Services and Materials,Corporate & Professional Services,Financial Services,"Audit, Tax & Advisory Services"
,Scalable Cloud Solutions,"A comprehensive suite of cloud services offering flexible IaaS, PaaS, and SaaS solutions for businesses of all sizes.",KG,False,Indirect Services and Materials,IT & Technology,IT Services & Telecom,"Cloud & Hosting (IaaS, PaaS, SaaS)"
,LeadGen Pro,A comprehensive lead generation service that connects businesses with targeted audiences through advanced marketing strategies.,Set,True,Indirect Services and Materials,Marketing & Sales,Sales Support,Lead Generation Services
,Insight Analytics Dashboard,A comprehensive data visualization tool that transforms raw survey results into actionable insights.,Set,False,Indirect Services and Materials,Marketing & Sales,Market Research,"Data, Surveys & Analysis"
,Achieve Rewards,Boost employee engagement through personalized sales incentives and recognition programs.,KG,False,Indirect Services and Materials,Marketing & Sales,Sales Support,Sales Incentive & Reward Programs
,DataVision Pro,A powerful business intelligence tool that transforms complex data into actionable insights through advanced visualization and analytics.,KG,True,Indirect Services and Materials,IT & Technology,Software,"Business Intelligence & Analytics (BI, Data Visualization)"
,Elite Printing Solutions,"Professional print services offering high-quality printing, copying, and binding solutions for all your document needs.",Piece,False,Indirect Services and Materials,Facility Services,Office Supplies & Services,Print & Copy Services
,RewardBoost,An innovative sales incentive platform that gamifies work culture and boosts team performance through dynamic rewards.,Piece,False,Indirect Services and Materials,Marketing & Sales,Sales Support,Sales Incentive & Reward Programs
,Global Visa Assistance,"Comprehensive support for visa applications, processing updates, and travel advisories.",KG,False,Indirect Services and Materials,Corporate Travel,Travel Management Services,Visa & Immigration Support
,Mastering Sales Conversations,A comprehensive program that teaches effective communication strategies to boost sales performance.,Piece,True,Indirect Services and Materials,Marketing & Sales,Sales Support,Sales Training
,Express Rail Connect,"A high-speed rail service offering comfortable seating, real-time tracking updates, and eco-friendly travel.",Box,False,Indirect Services and Materials,Corporate Travel,Transportation,Rail Services
,Legal Insight Mediation,A comprehensive platform offering expert guidance and tools to streamline the mediation process in litigation disputes.,Set,False,Indirect Services and Materials,Corporate & Professional Services,Legal Services,Litigation & Dispute Resolution
,TrackPro Pro,"A robust telematics solution offering real-time GPS tracking, driver analytics, and fleet maintenance alerts to enhance operational efficiency.",Piece,False,Indirect Services and Materials,Logistics,Fleet Management,Telematics & Fleet Tracking
,ProcessFlow Pro,A comprehensive software solution designed to streamline operations and enhance process efficiency across various departments.,KG,False,Indirect Services and Materials,Corporate & Professional Services,Consulting,Operations & Process Improvement
,Comprehensive Audit Solutions,A full suite of professional audit services designed to ensure compliance and optimize financial performance.,Set,True,Indirect Services and Materials,Corporate & Professional Services,Financial Services,"Audit, Tax & Advisory Services"
,SalesForce Pro,An advanced CRM tool designed to streamline sales processes and enhance customer relationships through integrated analytics.,Piece,False,Indirect Services and Materials,Marketing & Sales,Sales Support,Customer Relationship Management (CRM) Tools
,Premium Print Solutions,"High-quality print services including photo prints, business cards, flyers, and custom packaging.",Box,False,Indirect Services and Materials,Facility Services,Office Supplies & Services,Print & Copy Services
,SwiftShip Express,A fast and reliable courier service offering secure delivery solutions for time-sensitive parcels.,Set,True,Indirect Services and Materials,Logistics,Transportation & Freight,Parcel & Courier Services
,Streamline HR Solutions,A comprehensive recruitment and staffing service designed to efficiently find and onboard permanent and temporary talent.,Set,False,Indirect Services and Materials,Corporate & Professional Services,Human Resources Services,"Recruitment & Staffing (Permanent, Temporary)"
,BookMaster Pro,An advanced online booking tool that simplifies scheduling and enhances customer engagement through customizable interfaces and real-time availability tracking.,Box,False,Indirect Services and Materials,Corporate Travel,Travel Management Services,Online Booking Tools (OBTs)
,WorkFlow Pro,An all-in-one productivity and collaboration suite designed to streamline your workflow and enhance team communication.,Set,False,Indirect Services and Materials,IT & Technology,Software,"Productivity & Collaboration Suites (Office, Email)"
,ComplianceGuard Pro,A comprehensive security solution that ensures your data is protected and compliance standards are met.,KG,False,Indirect Services and Materials,IT & Technology,Software,Security & Compliance Software
,Innovate Creative Solutions,A forward-thinking agency specializing in innovative content strategies and branding solutions to elevate your brand's visibility.,Piece,False,Indirect Services and Materials,Marketing & Sales,Marketing & Advertising,"Creative, Content & Branding Agencies"
,WorkFlow Solutions,An AI-powered HR technology platform that streamlines employee onboarding and enhances performance management.,Set,True,Indirect Services and Materials,Corporate & Professional Services,Human Resources Services,HR Consulting & Technology
,TechNova Solutions,Specializing in cutting-edge IT consulting and implementation services tailored to enhance your business efficiency.,KG,False,Indirect Services and Materials,IT & Technology,IT Services & Telecom,IT Consulting & Implementation
,Streamline HR,"A comprehensive HR technology solution that optimizes hiring processes, employee engagement, and compliance management.",Box,False,Indirect Services and Materials,Corporate & Professional Services,Human Resources Services,HR Consulting & Technology
,SwiftTruck Logistics,A leading road freight service provider offering reliable FTL and LTL solutions for your business needs.,Piece,False,Indirect Services and Materials,Logistics,Transportation & Freight,"Road Freight (FTL, LTL)"
,SecureGuard Pro Firewall,Advanced firewall solution designed to protect your network from external threats and unauthorized access.,Piece,False,Indirect Services and Materials,IT & Technology,Hardware,"Networking (Routers, Switches, Firewalls)"
,Global Cargo Express,A premium air freight service ensuring timely delivery of your goods across continents.,KG,True,Indirect Services and Materials,Logistics,Transportation & Freight,Air & Ocean Freight
,SpendEdge,"A comprehensive expense management software that simplifies tracking, approval workflows, and budgeting to help businesses save time and money.",Piece,False,Indirect Services and Materials,Corporate Travel,Travel Management Services,Expense Management Software
,SEO Pro Max,"A powerful tool that optimizes your website's performance and visibility, helping you rank higher on search engines.",Set,False,Indirect Services and Materials,Marketing & Sales,Marketing & Advertising,Digital Marketing & SEO/SEM
,TechVision Solutions,Innovative IT consulting services that empower businesses to optimize their technology infrastructure and drive operational efficiency.,Box,False,Indirect Services and Materials,IT & Technology,IT Services & Telecom,IT Consulting & Implementation
,SleekDrive Monthly Lease,Affordable monthly lease option for premium vehicles without long-term commitment.,Piece,True,Indirect Services and Materials,Logistics,Fleet Management,Vehicle Leasing & Purchase
,OptiTech Solutions,A leading IT consulting firm specializing in innovative technology implementation and strategic advice to enhance business performance.,Box,True,Indirect Services and Materials,IT & Technology,IT Services & Telecom,IT Consulting & Implementation
,EcoClean Pro,A professional-grade cleaning solution that effectively removes tough stains and odors while being environmentally friendly.,Box,False,Indirect Services and Materials,Facility Services,Facility Management,Janitorial & Cleaning Services
,Global Visa Express,A comprehensive service offering expert guidance and streamlined processes for visa applications across various countries.,KG,True,Indirect Services and Materials,Corporate Travel,Travel Management Services,Visa & Immigration Support
,BookingPro,An intuitive online booking tool that streamlines scheduling and enhances customer experience.,KG,False,Indirect Services and Materials,Corporate Travel,Travel Management Services,Online Booking Tools (OBTs)
,Garden Pro Premium Soil Mix,A high-quality soil mix designed to enhance plant growth and support healthy landscaping.,Box,False,Indirect Services and Materials,Facility Services,Facility Management,Landscaping & Groundskeeping
,Global Freight Solutions,A comprehensive freight forwarding and customs brokerage service connecting businesses globally with tailored shipping solutions.,Set,False,Indirect Services and Materials,Logistics,Transportation & Freight,Freight Forwarding & Customs Brokerage
,GlobalRoute Connect,"An advanced travel management platform that offers seamless booking, itinerary optimization, and real-time updates for travelers worldwide.",KG,False,Indirect Services and Materials,Corporate Travel,Travel Management Services,Travel Management Companies (TMCs)
,SmartStock Pro,"An advanced inventory management system that optimizes stock levels, reduces waste, and enhances supply chain efficiency.",KG,False,Indirect Services and Materials,Logistics,Warehousing & Distribution,Inventory Management Systems
,PartyPro Solutions,"All-in-one event management software that streamlines planning and execution of weddings, corporate events, and festivals.",KG,False,Indirect Services and Materials,Marketing & Sales,Events & Promotions,Event Management & Production
,CloudSphere Managed,"A comprehensive cloud service platform offering scalable IaaS, robust PaaS solutions, and user-friendly SaaS applications.",Piece,False,Indirect Services and Materials,IT & Technology,IT Services & Telecom,"Cloud & Hosting (IaaS, PaaS, SaaS)"
,SecureGuard Pro,"A comprehensive cybersecurity service platform offering advanced penetration testing, real-time monitoring, and a robust Security Operations Center to protect your digital assets.",Set,False,Indirect Services and Materials,IT & Technology,IT Services & Telecom,"Cybersecurity Services (Pen Testing, Monitoring, SOC)"
,GlobalPath TMC Solutions,Streamline your travel logistics and maximize efficiency with our comprehensive TMC services.,KG,False,Indirect Services and Materials,Corporate Travel,Travel Management Services,Travel Management Companies (TMCs)
,ProcessFlow Optimizer,An innovative software tool designed to streamline operations and enhance process efficiency.,Piece,False,Indirect Services and Materials,Corporate & Professional Services,Consulting,Operations & Process Improvement
,Global Logistics Solutions,A comprehensive freight forwarding and customs brokerage service ensuring seamless international trade operations.,Box,False,Indirect Services and Materials,Logistics,Transportation & Freight,Freight Forwarding & Customs Brokerage
,MasterMind Sales Academy,An immersive online platform offering comprehensive sales training modules designed to enhance your skills and boost performance.,Box,True,Indirect Services and Materials,Marketing & Sales,Sales Support,Sales Training
,NetSuite Business Suite,A comprehensive cloud-based ERP solution designed to streamline business processes and enhance operational efficiency for enterprises of all sizes.,Piece,False,Indirect Services and Materials,IT & Technology,Software,"Enterprise Applications (ERP, CRM, SCM)"
,Luxury Sprinter Van Rental,A sleek and spacious van perfect for business trips or weekend getaways.,Set,False,Indirect Services and Materials,Corporate Travel,Transportation,Car Rentals
,SafeGuard Pro,"A state-of-the-art alarm system that monitors your home or office, providing unparalleled security and real-time alerts to keep you safe.",Set,False,Indirect Services and Materials,Facility Services,Security Services,Alarm Systems & Monitoring
,SkyComfort Plus,An airline offering premium comfort seats and exceptional service on all routes.,Piece,False,Indirect Services and Materials,Corporate Travel,Transportation,Airlines
,EcoStay,A sustainable hotel chain offering eco-friendly amenities and services to promote environmental responsibility.,Box,False,Indirect Services and Materials,Corporate Travel,Accommodation,Hotels & Chains
,SecureGuard Pro,A comprehensive cybersecurity solution offering continuous monitoring and advanced penetration testing to safeguard your digital assets.,KG,False,Indirect Services and Materials,IT & Technology,IT Services & Telecom,"Cybersecurity Services (Pen Testing, Monitoring, SOC)"
,BookEase Pro,An intuitive online booking platform designed to streamline reservations and enhance customer engagement.,Box,False,Indirect Services and Materials,Corporate Travel,Travel Management Services,Online Booking Tools (OBTs)
,FlavorFlex Snack Packs,"Freshly prepared snack packs perfect for on-the-go enjoyment at events, offices, or busy days.",KG,True,Indirect Services and Materials,Facility Services,Office Supplies & Services,Catering & Vending Services
,GardenPro Propane Heater,A durable propane heater designed to keep your outdoor activities comfortable even during chilly evenings.,Box,False,Indirect Services and Materials,Facility Services,Facility Management,Landscaping & Groundskeeping
,DataViz Pro,A comprehensive business intelligence and analytics platform designed to transform raw data into actionable insights.,Piece,False,Indirect Services and Materials,IT & Technology,Software,"Business Intelligence & Analytics (BI, Data Visualization)"
,EcoDrive Monthly,Affordable monthly leasing plans that help you reduce your carbon footprint while enjoying reliable transportation.,KG,False,Indirect Services and Materials,Logistics,Fleet Management,Vehicle Leasing & Purchase
,TaxPro Advisor,"A comprehensive platform offering expert tax planning, compliance solutions, and advisory services to streamline your financial processes.",Piece,False,Indirect Services and Materials,Corporate & Professional Services,Financial Services,"Audit, Tax & Advisory Services"
,SecureGuard Pro,A comprehensive security solution that ensures compliance with industry standards and protects your data from threats.,Box,False,Indirect Services and Materials,IT & Technology,Software,Security & Compliance Software
,TechGuard Pro,A durable tablet designed to withstand daily use while offering top-tier performance and connectivity.,Box,False,Indirect Services and Materials,IT & Technology,Hardware,"Mobile Devices (Tablets, Smartphones, Accessories)"
,UltraView Pro Projector,A high-resolution projector designed for crystal-clear presentations and immersive viewing experiences.,Box,False,Indirect Services and Materials,IT & Technology,Hardware,"Audio/Visual Equipment (Projectors, Conferencing Systems)"
