sku,name,description,unitOfMeasure,isCritical,category_L1,category_L2,category_L3,category_L4
PROD-72335d,Polyester Resin Blend,"A versatile, high-performance resin blend ideal for industrial applications and manufacturing processes.",KG,True,Direct Materials,Raw Materials,Plastics & Polymers,"Resins (PET, HDPE)"
PROD-329189,Clear Accordion File Labels,"Sturdy, reusable labels perfect for organizing files and documents.",Set,False,Direct Materials,Packaging Materials,Tertiary Packaging & Shipping Supplies,Labels & Inserts
PROD-759886,SilkGuard Anti-Fade Enamel,"A premium, non-toxic coating that protects against UV rays and environmental damage while adding a beautiful sheen to your surfaces.",Box,True,Direct Materials,Raw Materials,Chemicals,"Coatings, Pigments & Dyes"
PROD-beda3c,Precision Aluminum Alloy Profile,High-quality stamped metal parts designed for structural applications requiring durability and lightweight properties.,Piece,False,Direct Materials,Components & Sub-Assemblies,Fabricated Parts,Stamped Metal Parts
PROD-2a84d2,UltraFast Logic Chip,A high-performance integrated circuit designed to enhance data processing speeds and efficiency.,Box,False,Direct Materials,Components & Sub-Assemblies,Electronic Components,Semiconductors & Integrated Circuits
PROD-99c633,Advanced Silicon Wafer,A high-quality semiconductor substrate used for manufacturing integrated circuits and other electronic components.,Set,True,Direct Materials,Components & Sub-Assemblies,Electronic Components,Semiconductors & Integrated Circuits
PROD-c6e3d9,Quinoa Harvest,"Organically grown quinoa grains perfect for cooking or snacking, rich in protein and nutrients.",Piece,False,Direct Materials,Raw Materials,Agricultural Products,Grains & Cereals
PROD-48d0a5,PureTech Advanced Cleaner,"A highly concentrated, eco-friendly cleaning solution perfect for industrial and commercial use.",Piece,False,Direct Materials,Raw Materials,Chemicals,Bulk & Specialty Chemicals
PROD-2ea8ef,Aluminum PCB 3000,High-performance printed circuit board designed for efficient heat dissipation and enhanced electrical performance.,Set,False,Direct Materials,Components & Sub-Assemblies,Electronic Components,Printed Circuit Boards (PCBs)
PROD-db1a74,Precision Alloy Casting,High-quality castings made from premium alloy materials for industrial applications.,KG,False,Direct Materials,Components & Sub-Assemblies,Fabricated Parts,Castings & Forgings
PROD-db239d,Steel Pallets - Heavy Duty,Durable steel pallets designed to withstand heavy loads and rough handling environments.,Piece,False,Direct Materials,Packaging Materials,Tertiary Packaging & Shipping Supplies,Pallets & Crates
PROD-161361,Organic Cotton Linen Blend Tote,"A durable, eco-friendly tote bag made from a blend of organic cotton and linen fibers.",Box,True,Direct Materials,Raw Materials,Agricultural Products,"Fibers (Cotton, Wool)"
PROD-a10ea3,Eco-Friendly Reusable Shopping Bag,A durable and stylish bag designed to reduce plastic waste while providing ample space for your groceries.,Piece,True,Direct Materials,Packaging Materials,Primary Packaging,"Bags, Pouches & Wrappers"
PROD-9474ec,PrintPro Label Maker,A versatile label maker that allows you to create customized labels quickly and easily.,Set,False,Direct Materials,Packaging Materials,Tertiary Packaging & Shipping Supplies,Labels & Inserts
PROD-06164e,RapidPro PCB,"High-speed, low-profile printed circuit board designed for compact electronic devices.",Set,False,Direct Materials,Components & Sub-Assemblies,Electronic Components,Printed Circuit Boards (PCBs)
PROD-602f1c,Precision Roller Bearing Set,"High-quality, durable bearings designed to reduce friction and enhance performance in machinery.",KG,True,Direct Materials,Components & Sub-Assemblies,Mechanical Components,Bearings & Gears
PROD-d763b4,Precision Resistor Kit,A collection of high-precision resistors designed for accurate and reliable performance in electronic circuits.,Set,False,Direct Materials,Components & Sub-Assemblies,Electronic Components,"Passive Components (Resistors, Capacitors)"
PROD-274c2d,Precision Threaded Hex Bolt,A high-quality hex bolt designed for demanding fastening applications requiring reliable and durable connections.,Piece,False,Direct Materials,Components & Sub-Assemblies,Mechanical Components,"Fasteners (Nuts, Bolts, Screws)"
PROD-14dcbe,StackMaster Tray Set,Elegant stackable trays with adjustable dividers to organize and transport your items efficiently.,Piece,False,Direct Materials,Packaging Materials,Secondary Packaging,Trays & Dividers
PROD-28a344,Aluminum PCB,A high-performance printed circuit board designed for efficient heat dissipation and enhanced electrical performance.,Set,False,Direct Materials,Components & Sub-Assemblies,Electronic Components,Printed Circuit Boards (PCBs)
PROD-ff8fec,Precision CNC-Processed Aluminum Alloy Bracket,"A durable, machined aluminum bracket designed for high-stress applications and optimized for precise alignment.",KG,False,Direct Materials,Components & Sub-Assemblies,Fabricated Parts,Machined Parts
PROD-df2fb8,Polyester Resin Sheet,"A durable, high-quality sheet of polyester resin ideal for industrial applications.",Piece,False,Direct Materials,Raw Materials,Plastics & Polymers,"Resins (PET, HDPE)"
PROD-2fa8d6,Industrial Steel Pallet,"A durable, reusable pallet designed to withstand heavy loads and facilitate efficient material handling.",Box,False,Direct Materials,Packaging Materials,Tertiary Packaging & Shipping Supplies,Pallets & Crates
PROD-69b916,FlexiWrap Stretching Band,"A versatile, adjustable stretching band that helps improve flexibility and muscle tone.",Piece,False,Direct Materials,Packaging Materials,Tertiary Packaging & Shipping Supplies,Stretch & Shrink Wrap
PROD-a03eb8,Precision Machined Steel Plate,High-quality stamped metal part designed for structural applications.,Box,False,Direct Materials,Components & Sub-Assemblies,Fabricated Parts,Stamped Metal Parts
PROD-149b58,Stackable Tray Set,"Durable, stackable trays perfect for organizing meals and snacks at home.",KG,False,Direct Materials,Packaging Materials,Secondary Packaging,Trays & Dividers
PROD-880677,Organic Cotton T-Shirt,"Made from high-quality organic cotton, perfect for everyday wear and environmentally conscious fashion.",Piece,False,Direct Materials,Raw Materials,Agricultural Products,"Fibers (Cotton, Wool)"
PROD-09c333,NanoFlex Semiconductor,A high-performance integrated circuit designed for efficient power management and signal processing.,Box,False,Direct Materials,Components & Sub-Assemblies,Electronic Components,Semiconductors & Integrated Circuits
PROD-d5ec11,Steel Reinforced Pallet,Durable pallet designed to handle heavy loads safely and securely.,Set,False,Direct Materials,Packaging Materials,Tertiary Packaging & Shipping Supplies,Pallets & Crates
PROD-5a4d5d,GigaBoard Pro,A high-performance printed circuit board designed for advanced electronic applications.,KG,False,Direct Materials,Components & Sub-Assemblies,Electronic Components,Printed Circuit Boards (PCBs)
PROD-36e376,Eco-Friendly Cotton T-Shirt,A breathable and soft cotton t-shirt perfect for everyday wear.,Box,False,Direct Materials,Raw Materials,Agricultural Products,"Fibers (Cotton, Wool)"
PROD-fa3c0c,Advanced Power Management IC,A high-efficiency integrated circuit designed to optimize power consumption and improve system performance.,Piece,True,Direct Materials,Components & Sub-Assemblies,Electronic Components,Semiconductors & Integrated Circuits
PROD-e5437f,Heavy-Duty Steel Bolt,A durable and robust bolt designed to withstand heavy loads and provide secure fastening for industrial applications.,Piece,False,Direct Materials,Components & Sub-Assemblies,Mechanical Components,"Fasteners (Nuts, Bolts, Screws)"
PROD-166afb,Eco-Friendly Shopping Tote,A durable and stylish reusable tote bag perfect for your daily shopping trips.,KG,False,Direct Materials,Packaging Materials,Primary Packaging,"Bags, Pouches & Wrappers"
PROD-bb20e2,Ultra-Fast Logic Chip,A high-speed integrated circuit designed for optimal performance in demanding computing applications.,Box,False,Direct Materials,Components & Sub-Assemblies,Electronic Components,Semiconductors & Integrated Circuits
PROD-c8448b,Eco-Friendly Plastic Pallets,"Durable, reusable plastic pallets designed to reduce environmental impact and enhance logistics efficiency.",Box,False,Direct Materials,Packaging Materials,Tertiary Packaging & Shipping Supplies,Pallets & Crates
PROD-097747,EcoShield Aluminum Can,A lightweight and eco-friendly aluminum can designed for sustainable beverage packaging.,Box,False,Direct Materials,Raw Materials,Metals & Minerals,"Non-Ferrous Metals (Aluminum, Copper, Lithium)"
PROD-37fa64,PureClean Solvent,A versatile solvent suitable for cleaning tools and surfaces while maintaining their integrity.,KG,False,Direct Materials,Raw Materials,Chemicals,Solvents & Adhesives
PROD-7b16b2,Water Soluble Glue,"A non-toxic adhesive that dissolves easily in water, ideal for crafting and small repairs.",Box,False,Direct Materials,Raw Materials,Chemicals,Solvents & Adhesives
PROD-685680,PowerMax Turbo Pump,A high-performance motor designed to deliver efficient and reliable power across various industrial applications.,Piece,True,Direct Materials,Components & Sub-Assemblies,Mechanical Components,Motors & Pumps
PROD-d0edd7,Synthetic Lubricant X-300,A high-performance synthetic lubricant designed to protect machinery and extend equipment life under demanding conditions.,Set,True,Technical Materials,"MRO (Maintenance, Repair & Operations)",Industrial Consumables,"Lubricants, Oils & Greases"
PROD-5dcfe6,All-Purpose Glass Cleaner,"A versatile cleaner designed to effectively remove tough grime and streaks from windows, mirrors, and glass surfaces.",Box,False,Technical Materials,"MRO (Maintenance, Repair & Operations)",Industrial Consumables,Cleaning Agents & Janitorial Supplies
PROD-fbfde1,Precision CNC Lathe Machine,A high-performance CNC lathe machine designed for precision machining of complex parts.,KG,False,Technical Materials,Manufacturing Equipment,Production Machinery,CNC Machines & Lathes
PROD-88eb5e,EcoClean Pro,"A powerful, eco-friendly cleaning agent that effectively removes tough stains while being safe for both your health and the environment.",KG,True,Technical Materials,"MRO (Maintenance, Repair & Operations)",Industrial Consumables,Cleaning Agents & Janitorial Supplies
PROD-e5487d,Pro-Grip Sandpaper Kit,High-quality sandpaper sheets designed to provide superior performance and durability for a wide range of woodworking and metalworking projects.,KG,False,Technical Materials,"MRO (Maintenance, Repair & Operations)",Industrial Consumables,Abrasives & Welding Supplies
PROD-f508b2,Calibrated Precision Multimeter,"A reliable device that accurately measures voltage, current, and resistance to ensure optimal performance in various testing scenarios.",KG,False,Technical Materials,R&D and Laboratory,Lab Equipment,Measurement & Testing Instruments
PROD-da8d74,RoboMold,"An advanced robotic system designed to streamline mold filling processes on an assembly line, enhancing precision and efficiency.",Box,False,Technical Materials,Manufacturing Equipment,Production Machinery,Assembly Line Automation & Robotics
PROD-0576a5,Advanced Forklift Pro,A robust and efficient lift truck designed for heavy-duty material handling operations.,Box,False,Technical Materials,Manufacturing Equipment,Material Handling Equipment,Forklifts & Pallet Jacks
PROD-d00d47,3D Printing Plastic Filament - Rapid Prototyping,"High-quality, durable filament ideal for rapid prototyping and 3D printing applications.",Piece,False,Technical Materials,R&D and Laboratory,Prototyping Services & Materials,Rapid Prototyping Materials
PROD-3dd123,Tritanium Alloy Sheet,High-strength titanium alloy sheets ideal for rapid prototyping and functional parts.,Box,False,Technical Materials,R&D and Laboratory,Prototyping Services & Materials,Rapid Prototyping Materials
PROD-a8d207,EcoGlow Glass,"A stylish, energy-efficient glass option that combines aesthetics with sustainability.",KG,False,Technical Materials,R&D and Laboratory,Lab Supplies,Glassware & Plasticware
PROD-50aed0,ProClean All-Purpose Cleaner,"A versatile, eco-friendly cleaner that effectively removes dirt and grime from any surface.",Set,False,Technical Materials,"MRO (Maintenance, Repair & Operations)",Industrial Consumables,Cleaning Agents & Janitorial Supplies
PROD-1d95c7,OptiFlow Conveyor,"A high-speed, energy-efficient conveyor system designed for seamless material handling in industrial environments.",Box,False,Technical Materials,Manufacturing Equipment,Material Handling Equipment,Conveyor Systems
PROD-551998,Precision Cutting Machine,An advanced processing equipment designed to provide accurate and efficient cutting solutions for various materials.,Box,False,Technical Materials,Manufacturing Equipment,Production Machinery,Processing Equipment
PROD-b07b9d,Elegant Clear Glass,A stylish clear glass designed for everyday use and special occasions.,Box,False,Technical Materials,R&D and Laboratory,Lab Supplies,Glassware & Plasticware
PROD-897212,Optima Spectra-4000,A state-of-the-art spectrometer designed for precise and reliable analysis of complex samples.,Box,False,Technical Materials,R&D and Laboratory,Lab Equipment,"Analytical Equipment (Spectrometers, Microscopes)"
PROD-ffb576,Advanced Conveyor System X,A high-performance conveyor system designed to optimize material handling and increase operational efficiency.,Box,False,Technical Materials,Manufacturing Equipment,Material Handling Equipment,Conveyor Systems
PROD-12a81f,Precision Drilling Fixture,A high-precision tool designed to accurately position and secure workpieces during drilling operations.,Piece,False,Technical Materials,Manufacturing Equipment,Tooling & Molds,"Dies, Jigs & Fixtures"
PROD-163862,Advanced Rapid Prototyping Solutions,"High-quality, durable prototypes delivered on-demand using state-of-the-art 3D printing technology.",Piece,False,Technical Materials,R&D and Laboratory,Prototyping Services & Materials,3D Printing Services
PROD-2b9562,High-Pressure Hydraulic Pump Seal,A durable replacement seal designed to maintain optimal performance and reduce leakage in high-pressure hydraulic systems.,Piece,True,Technical Materials,"MRO (Maintenance, Repair & Operations)",Spare Parts,Equipment-Specific Spare Parts
PROD-32cefa,Precision Mold Set,A high-quality mold set designed for intricate patterns and durable construction.,Piece,False,Technical Materials,Manufacturing Equipment,Tooling & Molds,Molds & Patterns
PROD-76919d,Precision CNC Lathe Machine,A high-precision CNC lathe machine designed to deliver accurate and efficient metalworking operations.,Piece,True,Technical Materials,Manufacturing Equipment,Production Machinery,CNC Machines & Lathes
PROD-7e8134,RoboLine 3000,An advanced robotic assembly line system designed to streamline production processes and enhance efficiency.,Set,False,Technical Materials,Manufacturing Equipment,Production Machinery,Assembly Line Automation & Robotics
PROD-e6034e,MaxiFlow Conveyor System,A durable and efficient conveyor system designed to streamline material handling processes in warehouses.,Box,False,Technical Materials,Manufacturing Equipment,Material Handling Equipment,Conveyor Systems
PROD-c11903,Eco-Sip Reusable Glass Bottle,"A durable, BPA-free glass bottle designed for both everyday use and eco-conscious living.",Set,False,Technical Materials,R&D and Laboratory,Lab Supplies,Glassware & Plasticware
PROD-5abc00,EcoBite Glassware Set,"A set of durable, eco-friendly glassware perfect for everyday use and special occasions.",KG,True,Technical Materials,R&D and Laboratory,Lab Supplies,Glassware & Plasticware
PROD-a1cc03,BioPure Enzyme Solution,A high-purity enzyme solution ideal for biochemical research and laboratory applications.,Set,False,Technical Materials,R&D and Laboratory,Lab Supplies,Chemicals & Reagents
PROD-81acf1,Precision Punch Set,High-quality punch set ideal for cutting and perforating materials in manufacturing processes.,Box,False,Technical Materials,Manufacturing Equipment,Tooling & Molds,"Dies, Jigs & Fixtures"
PROD-126685,ProGuard Forklift,A high-performance electric forklift designed to enhance safety and efficiency in warehouse operations.,Set,False,Technical Materials,Manufacturing Equipment,Material Handling Equipment,Forklifts & Pallet Jacks
PROD-a12e4b,FlexiForm Rapid Prototype Material,A versatile thermoplastic material designed for quick and durable prototyping applications.,Box,False,Technical Materials,R&D and Laboratory,Prototyping Services & Materials,Rapid Prototyping Materials
PROD-1ffb1a,Precision Cutting Die Set,High-quality die set designed to ensure accurate and consistent cutting results.,KG,False,Technical Materials,Manufacturing Equipment,Tooling & Molds,"Dies, Jigs & Fixtures"
PROD-1cf13e,Quantum Spectra Analyzer,A state-of-the-art spectrometer designed for precise and accurate analysis of light spectra across various wavelengths.,KG,False,Technical Materials,R&D and Laboratory,Lab Equipment,"Analytical Equipment (Spectrometers, Microscopes)"
PROD-ddf716,SpeedPro 3000,A high-speed industrial processing machine designed to handle large volumes of materials efficiently and reliably.,KG,False,Technical Materials,Manufacturing Equipment,Production Machinery,Processing Equipment
PROD-302086,Eco-Friendly LiftMaster Pro,A sustainable electric forklift designed to reduce carbon footprint and enhance workplace safety.,Box,True,Technical Materials,Manufacturing Equipment,Material Handling Equipment,Forklifts & Pallet Jacks
PROD-8a152d,Heavy-Duty Engine Oil Filter,"A high-performance oil filter designed to withstand extreme temperatures and pressures, ensuring optimal engine performance.",KG,False,Technical Materials,"MRO (Maintenance, Repair & Operations)",Spare Parts,Equipment-Specific Spare Parts
PROD-0100ab,Universal Valve Set,Durable replacement valve set designed for high-pressure industrial applications.,Piece,False,Technical Materials,"MRO (Maintenance, Repair & Operations)",Spare Parts,"General Industrial Spares (Valves, Belts)"
PROD-b38c2d,BioPure Enzyme Solution,A high-quality enzyme solution designed to enhance biological processes in laboratory experiments and industrial applications.,Piece,False,Technical Materials,R&D and Laboratory,Lab Supplies,Chemicals & Reagents
PROD-7f9b5f,Eco-Friendly LiftMaster Pro,A durable and eco-friendly lift truck designed to handle a wide range of material handling tasks efficiently.,KG,False,Technical Materials,Manufacturing Equipment,Material Handling Equipment,Forklifts & Pallet Jacks
PROD-40ea25,EcoCrystal Glass,A sleek and sustainable glass option perfect for everyday use or special occasions.,Box,False,Technical Materials,R&D and Laboratory,Lab Supplies,Glassware & Plasticware
PROD-79f105,RoboMate Industrial,A versatile robotic system designed to optimize assembly line operations and enhance productivity.,Piece,True,Technical Materials,Manufacturing Equipment,Production Machinery,Assembly Line Automation & Robotics
PROD-2ea256,PowerPro Electric Forklift,A robust electric forklift designed to enhance productivity and efficiency in warehouse operations.,KG,False,Technical Materials,Manufacturing Equipment,Material Handling Equipment,Forklifts & Pallet Jacks
PROD-f3fffe,Synthetic Lubricant X,A high-performance synthetic lubricant designed to reduce friction and enhance equipment longevity.,Piece,False,Technical Materials,"MRO (Maintenance, Repair & Operations)",Industrial Consumables,"Lubricants, Oils & Greases"
PROD-b88ea6,FlexiFlow Conveyance,A versatile conveyor system designed to handle a wide range of materials efficiently and safely.,KG,False,Technical Materials,Manufacturing Equipment,Material Handling Equipment,Conveyor Systems
PROD-3af165,SwiftFlow Conveyors,High-speed automated conveyor systems designed for efficient material handling and logistics.,Piece,False,Technical Materials,Manufacturing Equipment,Material Handling Equipment,Conveyor Systems
PROD-bf1340,Precision Punch Set,A set of durable punches designed to enhance accuracy and efficiency in manufacturing processes.,Set,False,Technical Materials,Manufacturing Equipment,Tooling & Molds,"Dies, Jigs & Fixtures"
PROD-74da19,Guardian Fall Safety Harness,A durable fall protection harness designed to ensure maximum safety during work at heights.,Box,False,Technical Materials,"MRO (Maintenance, Repair & Operations)",Safety & PPE (Personal Protective Equipment),Fall Protection & Respiratory Gear
PROD-c7fc47,Silicone Lubricant Spray,A high-quality silicone-based lubricant spray that provides long-lasting protection and smooth operation for all your machinery needs.,Piece,False,Technical Materials,"MRO (Maintenance, Repair & Operations)",Industrial Consumables,"Lubricants, Oils & Greases"
PROD-d04aaf,Heavy Duty Forklift Model X,"The ultimate solution for efficient and safe material handling, designed to streamline your warehouse operations.",Piece,False,Technical Materials,Manufacturing Equipment,Material Handling Equipment,Forklifts & Pallet Jacks
PROD-6dcdd1,Calibration Pro X10,A versatile and precise instrument designed for accurate calibration of various measuring devices.,Set,True,Technical Materials,R&D and Laboratory,Lab Equipment,Measurement & Testing Instruments
PROD-5f87ae,Precision Milling Machine,Advanced milling equipment designed to deliver high precision and efficiency in manufacturing.,Piece,False,Technical Materials,Manufacturing Equipment,Production Machinery,Processing Equipment
PROD-880d71,Precision CNC Lathe,A high-speed CNC lathe designed for accurate and efficient machining of complex parts.,Box,False,Technical Materials,Manufacturing Equipment,Production Machinery,CNC Machines & Lathes
PROD-6cd5e7,RoboCraft Advanced Assembly Unit,"An advanced robotic system designed to streamline and optimize assembly line processes, reducing human error and increasing productivity.",KG,True,Technical Materials,Manufacturing Equipment,Production Machinery,Assembly Line Automation & Robotics
PROD-abceb9,OptiView Pro,A state-of-the-art spectrometer designed for precise and efficient material analysis.,KG,False,Technical Materials,R&D and Laboratory,Lab Equipment,"Analytical Equipment (Spectrometers, Microscopes)"
PROD-310e97,ProPower Lift,A robust electric pallet jack designed to enhance efficiency and ease of use in warehouse operations.,Piece,False,Technical Materials,Manufacturing Equipment,Material Handling Equipment,Forklifts & Pallet Jacks
PROD-4e34b9,RoboMover X200,Advanced robotic arm designed to streamline and enhance precision during assembly line operations.,Set,False,Technical Materials,Manufacturing Equipment,Production Machinery,Assembly Line Automation & Robotics
PROD-9c2e7f,ProGrip Diamond-Grinding Disc,A durable abrasive disc perfect for grinding and polishing surfaces in both professional and DIY projects.,Box,False,Technical Materials,"MRO (Maintenance, Repair & Operations)",Industrial Consumables,Abrasives & Welding Supplies
PROD-6db2f8,PureClean All-Purpose Cleaner,"A versatile cleaning agent that effectively removes dirt, grime, and stains on various surfaces.",Piece,False,Technical Materials,"MRO (Maintenance, Repair & Operations)",Industrial Consumables,Cleaning Agents & Janitorial Supplies
PROD-623ad5,Eco-Friendly Glass Water Bottle,"A durable, reusable glass bottle designed to reduce plastic waste and keep your drinks fresh.",Box,True,Technical Materials,R&D and Laboratory,Lab Supplies,Glassware & Plasticware
PROD-83913c,Precision Cutting Die Set,A durable set of cutting dies designed to enhance accuracy and efficiency in manufacturing processes.,Set,False,Technical Materials,Manufacturing Equipment,Tooling & Molds,"Dies, Jigs & Fixtures"
PROD-8a4031,Precision Diamond Grinding Wheel,"This high-quality diamond grinding wheel is perfect for achieving smooth, clean finishes on a variety of surfaces.",Set,True,Technical Materials,"MRO (Maintenance, Repair & Operations)",Industrial Consumables,Abrasives & Welding Supplies
PROD-f2b499,Precision Temperature Sensor,A highly accurate device designed to measure temperature variations in various environments.,Box,True,Technical Materials,R&D and Laboratory,Lab Equipment,Measurement & Testing Instruments
PROD-5fe78b,ProtectPro Safety Gear Set,"A comprehensive set of high-quality safety gloves, goggles, and hard hats designed to provide optimal protection for industrial environments.",Set,False,Technical Materials,"MRO (Maintenance, Repair & Operations)",Safety & PPE (Personal Protective Equipment),"Safety Gloves, Goggles & Hard Hats"
PROD-e7acd7,EcoCrystal Glass Set,Sustainably crafted glassware set featuring elegant crystal designs and eco-friendly production processes.,Box,False,Technical Materials,R&D and Laboratory,Lab Supplies,Glassware & Plasticware
PROD-6108b4,Elite LiftMaster Pro,A robust electric pallet jack designed for heavy-duty material handling and industrial use.,KG,False,Technical Materials,Manufacturing Equipment,Material Handling Equipment,Forklifts & Pallet Jacks
PROD-1f3a19,PrecisionPrint 3D,High-quality 3D printing services offering detailed and durable models with precise engineering.,Set,False,Technical Materials,R&D and Laboratory,Prototyping Services & Materials,3D Printing Services
PROD-abf3c8,RoboLine X-100,An advanced robotic assembly line system designed to streamline production processes and enhance efficiency.,Set,False,Technical Materials,Manufacturing Equipment,Production Machinery,Assembly Line Automation & Robotics
PROD-a8f1ca,EcoClean Pro,"A powerful, eco-friendly cleaner that effectively removes tough stains and disinfects surfaces without harsh chemicals.",Set,True,Technical Materials,"MRO (Maintenance, Repair & Operations)",Industrial Consumables,Cleaning Agents & Janitorial Supplies
