sku,name,description,unitOfMeasure,isCritical,category_L1,category_L2,category_L3,category_L4
PROD-ef47fa,Calibrated Precision Thermometer,A durable thermometer designed for accurate temperature measurements in various environments.,Piece,True,Technical Materials,R&D and Laboratory,Lab Equipment,Measurement & Testing Instruments
PROD-abb62b,High-Performance Motor Coupler,"This durable motor coupler is designed to withstand heavy-duty applications, ensuring optimal performance and reducing maintenance costs.",Piece,False,Technical Materials,"MRO (Maintenance, Repair & Operations)",Spare Parts,Equipment-Specific Spare Parts
PROD-e7daa9,EcoClean All-Purpose Cleaner,A powerful yet eco-friendly cleaner that effectively removes dirt and grime while being safe for all surfaces.,KG,False,Technical Materials,"MRO (Maintenance, Repair & Operations)",Industrial Consumables,Cleaning Agents & Janitorial Supplies
PROD-b33bea,Universal Valve Assembly Kit,Durable and versatile valve kit suitable for various industrial applications.,Box,False,Technical Materials,"MRO (Maintenance, Repair & Operations)",Spare Parts,"General Industrial Spares (Valves, Belts)"
PROD-c5eefa,Precision Sandpaper Kit,Essential tool kit featuring multiple grit sandpapers for smooth finishes and tough materials.,Piece,False,Technical Materials,"MRO (Maintenance, Repair & Operations)",Industrial Consumables,Abrasives & Welding Supplies
PROD-ae7b72,Precision Hole Punch Die,A high-quality metalworking die designed to punch precise holes efficiently and accurately for various applications.,KG,False,Technical Materials,Manufacturing Equipment,Tooling & Molds,"Dies, Jigs & Fixtures"
PROD-736a60,EcoCrystal Glass,Stylish and eco-friendly glassware perfect for everyday use or special occasions.,Box,False,Technical Materials,R&D and Laboratory,Lab Supplies,Glassware & Plasticware
PROD-1531e7,QuantumClean 5000,A high-performance cleaning agent that effectively removes stubborn residues while being safe and environmentally friendly.,Piece,False,Technical Materials,R&D and Laboratory,Lab Supplies,Chemicals & Reagents
PROD-fda530,RoboStream Conveyor System,An advanced robotic conveyor system designed to optimize material handling and streamline production processes.,KG,False,Technical Materials,Manufacturing Equipment,Production Machinery,Assembly Line Automation & Robotics
PROD-b0983d,Precision CNC Router,A versatile CNC machine designed to handle intricate routing tasks efficiently and accurately.,KG,False,Technical Materials,Manufacturing Equipment,Production Machinery,CNC Machines & Lathes
PROD-0a3d29,AirGuard Pro Fall Harness,A robust fall protection harness designed to provide maximum security and comfort during high-risk tasks.,KG,False,Technical Materials,"MRO (Maintenance, Repair & Operations)",Safety & PPE (Personal Protective Equipment),Fall Protection & Respiratory Gear
PROD-7b6cab,Precision CNC Lathe,A high-performance CNC lathe designed for accurate and efficient machining of metal components.,Set,False,Technical Materials,Manufacturing Equipment,Production Machinery,CNC Machines & Lathes
PROD-3481f6,GleamGuard Pro All-Purpose Cleaner,"A powerful, eco-friendly cleaner that effectively removes tough stains and disinfects surfaces.",Box,False,Technical Materials,"MRO (Maintenance, Repair & Operations)",Industrial Consumables,Cleaning Agents & Janitorial Supplies
,SecureGuard Pro,A robust security software solution designed to ensure compliance with industry standards and protect your data from unauthorized access.,KG,False,Indirect Services and Materials,IT & Technology,Software,Security & Compliance Software
,Elegant Event Solutions,"Professional event management services offering seamless planning, logistics, and execution to ensure your special occasions are unforgettable.",Set,False,Indirect Services and Materials,Marketing & Sales,Events & Promotions,Event Management & Production
,SmartPay Solutions,A comprehensive payroll system that streamlines pay calculations and ensures compliance with all labor laws.,Box,False,Indirect Services and Materials,Corporate & Professional Services,Human Resources Services,Payroll & Benefits Administration
,SocialBuzz Pro,"A comprehensive platform designed to elevate your social media presence and influence, offering tools for content creation, audience growth, and analytics tracking.",Box,False,Indirect Services and Materials,Marketing & Sales,Marketing & Advertising,Influencer & Social Media Marketing
,Mindful Media Solutions,Specializing in innovative branding strategies and captivating content creation to elevate your brand's presence.,KG,False,Indirect Services and Materials,Marketing & Sales,Marketing & Advertising,"Creative, Content & Branding Agencies"
,SkyComfort Premium,"Offering luxurious seating, gourmet meals, and seamless connectivity to enhance your travel experience.",Piece,False,Indirect Services and Materials,Corporate Travel,Transportation,Airlines
,GlobalRoute Solutions,"A leading Travel Management Company offering comprehensive travel services including itinerary planning, booking, and concierge support for business and leisure travelers.",Piece,False,Indirect Services and Materials,Corporate Travel,Travel Management Services,Travel Management Companies (TMCs)
,AutoCAD Architecture Pro,An advanced CAD software solution tailored for architects and designers to streamline workflow and enhance precision.,Box,True,Indirect Services and Materials,IT & Technology,Software,"Engineering & Design (CAD, PLM)"
,EcoSmart Keyboard,"A sleek, ergonomic keyboard designed to enhance productivity while reducing environmental impact.",Box,True,Indirect Services and Materials,IT & Technology,Hardware,"Peripherals & Accessories (Printers, Keyboards)"
,Office Print Pro,"A comprehensive print service offering high-quality printing, copying, and scanning solutions tailored to meet your office needs.",Set,False,Indirect Services and Materials,Facility Services,Office Supplies & Services,Print & Copy Services
,Tech Solutions Pro,A comprehensive IT consulting service offering tailored implementation strategies to optimize your business operations.,Piece,False,Indirect Services and Materials,IT & Technology,IT Services & Telecom,IT Consulting & Implementation
,TaxPro Advisor,Comprehensive tax planning and advisory services to optimize your financial strategy.,Piece,False,Indirect Services and Materials,Corporate & Professional Services,Financial Services,"Audit, Tax & Advisory Services"
,Smart Meter Pro,An advanced utility monitoring device that provides real-time energy usage data and alerts for optimal consumption.,Piece,False,Indirect Services and Materials,Facility Services,Real Estate & Utilities,"Utilities (Gas, Electricity, Water)"
,Global Impact Partners,A platform connecting businesses with impactful social projects to enhance their brand image and community engagement.,Box,False,Indirect Services and Materials,Marketing & Sales,Marketing & Advertising,Sponsorships & Partnerships
,NovaTab Pro,"A sleek, high-performance tablet designed for seamless multitasking and entertainment.",Set,False,Indirect Services and Materials,IT & Technology,Hardware,"Mobile Devices (Tablets, Smartphones, Accessories)"
,SnapPad Pro,"A sleek, high-performance tablet designed for productivity and entertainment on-the-go.",Box,False,Indirect Services and Materials,IT & Technology,Hardware,"Mobile Devices (Tablets, Smartphones, Accessories)"
,LogiX Solutions,Comprehensive third-party logistics services tailored to enhance your supply chain efficiency and customer satisfaction.,Piece,True,Indirect Services and Materials,Logistics,Warehousing & Distribution,3rd Party Logistics (3PL) Services
,InsightTrack Pro,A comprehensive tool for monitoring brand performance across multiple platforms and providing actionable insights to enhance marketing strategies.,Box,False,Indirect Services and Materials,Marketing & Sales,Market Research,Brand Tracking & Analytics
,SEO Mastermind,A comprehensive suite of tools to elevate your digital marketing strategies and ensure top search engine rankings.,Box,True,Indirect Services and Materials,Marketing & Sales,Marketing & Advertising,Digital Marketing & SEO/SEM
,Eco-Friendly Merchandise Solutions,Sustainable merchandising services that enhance brand visibility while promoting environmental responsibility.,Set,True,Indirect Services and Materials,Marketing & Sales,Sales Support,Merchandising Services
,LitigatePro Software,Advanced software designed to streamline litigation processes and enhance dispute resolution efficiency.,Set,False,Indirect Services and Materials,Corporate & Professional Services,Legal Services,Litigation & Dispute Resolution
,SkyMarine Logistics,A comprehensive solution combining air and ocean freight services to ensure seamless delivery of your goods worldwide.,KG,True,Indirect Services and Materials,Logistics,Transportation & Freight,Air & Ocean Freight
,SocialFlow Pro,A comprehensive platform designed to optimize your influencer and social media marketing strategies.,Set,False,Indirect Services and Materials,Marketing & Sales,Marketing & Advertising,Influencer & Social Media Marketing
,Professional Print Solutions,High-quality print and copy services to meet all your document needs,Box,False,Indirect Services and Materials,Facility Services,Office Supplies & Services,Print & Copy Services
,PatentPro Suite,A comprehensive software solution designed to streamline patent filing processes and enhance intellectual property protection strategies.,KG,False,Indirect Services and Materials,Corporate & Professional Services,Legal Services,Intellectual Property & Patents
,GreenPath Consultants,A leading provider of comprehensive environmental consulting services dedicated to sustainable development and resource efficiency.,KG,False,Indirect Services and Materials,Corporate & Professional Services,Consulting,Environmental & Sustainability Consulting
,Innovative Sales Incentives,Boost your sales team's performance with tailored rewards and recognition programs.,Piece,False,Indirect Services and Materials,Marketing & Sales,Sales Support,Sales Incentive & Reward Programs
,Gold Star Rewards,A comprehensive sales incentive program that recognizes and rewards top-performing employees.,KG,False,Indirect Services and Materials,Marketing & Sales,Sales Support,Sales Incentive & Reward Programs
,ExpressDelivery Pro,A fast and reliable service offering next-day delivery to your doorstep,Set,False,Indirect Services and Materials,Logistics,Transportation & Freight,Parcel & Courier Services
,SecureGuard Pro,A comprehensive security solution that ensures real-time monitoring and compliance across all systems.,Box,False,Indirect Services and Materials,IT & Technology,Software,Security & Compliance Software
,FreshBite Catering,Offering a wide range of gourmet catering options perfect for any event or gathering.,Set,False,Indirect Services and Materials,Facility Services,Office Supplies & Services,Catering & Vending Services
,EventFlow Pro,"A comprehensive event management software that streamlines planning, scheduling, and coordination for seamless execution.",Box,False,Indirect Services and Materials,Marketing & Sales,Events & Promotions,Event Management & Production
,Express Rail Travel,"The ultimate rail travel experience offering unparalleled comfort, speed, and reliability.",Set,False,Indirect Services and Materials,Corporate Travel,Transportation,Rail Services
,PatentLitigate,A comprehensive software platform designed to streamline patent litigation processes and enhance legal research capabilities.,Piece,False,Indirect Services and Materials,Corporate & Professional Services,Legal Services,Intellectual Property & Patents
,DesignMaster Pro,An advanced CAD software tool that streamlines engineering design processes and enhances collaboration.,Piece,False,Indirect Services and Materials,IT & Technology,Software,"Engineering & Design (CAD, PLM)"
,VisionPro X1,A sleek and powerful laptop designed for both work and entertainment.,Box,False,Indirect Services and Materials,IT & Technology,Hardware,"End-User Computing (Laptops, Desktops, Monitors)"
,Azure Cloud Storage,Secure and scalable cloud storage solution for businesses of all sizes,Piece,False,Indirect Services and Materials,IT & Technology,IT Services & Telecom,"Cloud & Hosting (IaaS, PaaS, SaaS)"
,Grand Haven Inn,"A luxurious hotel offering spacious rooms, gourmet dining, and top-notch amenities for an unforgettable stay.",Box,False,Indirect Services and Materials,Corporate Travel,Accommodation,Hotels & Chains
,GlobalRoute Solutions,A leading travel management company offering comprehensive services to optimize business travel experiences and reduce costs.,Piece,False,Indirect Services and Materials,Corporate Travel,Travel Management Services,Travel Management Companies (TMCs)
,SecureVault Bank Account,A high-security banking account offering advanced fraud protection and seamless online transactions.,Piece,False,Indirect Services and Materials,Corporate & Professional Services,Financial Services,Banking & Treasury Services
,SmartBooking Pro,A user-friendly online booking tool designed to streamline event scheduling and management.,Piece,False,Indirect Services and Materials,Corporate Travel,Travel Management Services,Online Booking Tools (OBTs)
,Global Travel Solutions,"A comprehensive travel management company offering personalized itineraries, real-time updates, and seamless booking across all your journeys.",KG,False,Indirect Services and Materials,Corporate Travel,Travel Management Services,Travel Management Companies (TMCs)
,SwiftFreight Express,A premium road freight service offering reliable and efficient FTL and LTL shipping solutions.,Box,False,Indirect Services and Materials,Logistics,Transportation & Freight,"Road Freight (FTL, LTL)"
,SecureGuard Pro,A comprehensive security software solution that ensures compliance with industry regulations and protects your data from cyber threats.,Set,False,Indirect Services and Materials,IT & Technology,Software,Security & Compliance Software
,ProTech Air Quality Monitor,This advanced device monitors air quality and temperature levels to ensure optimal comfort and health standards in buildings.,Box,False,Indirect Services and Materials,Facility Services,Facility Management,Building Maintenance & HVAC
,Innovative Media Solutions,Specializing in cutting-edge branding and content creation services to elevate your brand's presence.,KG,False,Indirect Services and Materials,Marketing & Sales,Marketing & Advertising,"Creative, Content & Branding Agencies"
,CostSentry Pro,"A comprehensive expense management software that simplifies tracking, approval workflows, and budgeting to help businesses save money.",Set,False,Indirect Services and Materials,Corporate Travel,Travel Management Services,Expense Management Software
,SecureGuard Pro,A cutting-edge alarm system with advanced monitoring capabilities to protect your home or office from intruders and potential threats.,Set,False,Indirect Services and Materials,Facility Services,Security Services,Alarm Systems & Monitoring
,Elegant Event Solutions,"All-in-one event management software that streamlines planning, coordination, and execution to ensure flawless events.",Piece,False,Indirect Services and Materials,Marketing & Sales,Events & Promotions,Event Management & Production
,MasterCAD Pro,A comprehensive CAD software solution designed to streamline engineering design and collaboration processes.,KG,False,Indirect Services and Materials,IT & Technology,Software,"Engineering & Design (CAD, PLM)"
,SecureGuard Plus,"A comprehensive insurance solution offering tailored policies for property protection, liability coverage, health benefits, and travel adventures.",Piece,True,Indirect Services and Materials,Corporate & Professional Services,Financial Services,"Insurance (Property, Liability, Health, Travel)"
,DocuSecure,A secure and efficient cloud-based solution for managing all your documents and communications.,KG,False,Indirect Services and Materials,Facility Services,Office Supplies & Services,Mail & Document Management
,SEO Pro Tools,A comprehensive suite of tools designed to enhance your digital marketing strategy and improve search engine rankings.,Piece,False,Indirect Services and Materials,Marketing & Sales,Marketing & Advertising,Digital Marketing & SEO/SEM
,SkyJet Express,"The SkyJet Express offers affordable, comfortable seating and quick connections to popular destinations worldwide.",Box,False,Indirect Services and Materials,Corporate Travel,Transportation,Airlines
,Harmony Suites,Cozy serviced apartments offering comfortable living spaces with all amenities for your stay.,Set,False,Indirect Services and Materials,Corporate Travel,Accommodation,Serviced Apartments
,CloudTech Solutions,"Transform your IT infrastructure into scalable, secure, and efficient systems with our expert consulting services.",Box,False,Indirect Services and Materials,IT & Technology,IT Services & Telecom,IT Consulting & Implementation
,SecureGuard Pro,"Advanced cybersecurity services including penetration testing, real-time monitoring, and a fully staffed Security Operations Center to ensure your data remains protected.",Box,False,Indirect Services and Materials,IT & Technology,IT Services & Telecom,"Cybersecurity Services (Pen Testing, Monitoring, SOC)"
,Eco-Friendly Bamboo Pen,"A durable and stylish pen made from sustainably sourced bamboo, perfect for eco-conscious consumers.",Box,False,Indirect Services and Materials,Facility Services,Office Supplies & Services,Stationery & Consumables
,ProcessFlow,"A comprehensive software solution designed to streamline operations, enhance productivity, and improve process efficiency.",Piece,False,Indirect Services and Materials,Corporate & Professional Services,Consulting,Operations & Process Improvement
,EcoFuel Card,A sustainable fuel card designed to reward eco-friendly driving habits and promote energy efficiency.,Set,False,Indirect Services and Materials,Logistics,Fleet Management,"Fuel, Fuel Cards & Management"
,EcoFlow Power Monitor,A smart device that tracks and optimizes your energy consumption to reduce utility costs.,Piece,False,Indirect Services and Materials,Facility Services,Real Estate & Utilities,"Utilities (Gas, Electricity, Water)"
,Insight Analytics Pro,Transform complex data into actionable insights with powerful analytics and visualization tools designed for professionals.,Piece,False,Indirect Services and Materials,IT & Technology,Software,"Business Intelligence & Analytics (BI, Data Visualization)"
,Artisan Creative Solutions,Specializing in innovative branding strategies and compelling content creation to elevate your brand's presence.,Box,False,Indirect Services and Materials,Marketing & Sales,Marketing & Advertising,"Creative, Content & Branding Agencies"
,GreenThumb Watering Can,A stylish and functional watering can perfect for your gardening needs.,KG,False,Indirect Services and Materials,Facility Services,Facility Management,Landscaping & Groundskeeping
,Elite Security Force,Dedicated to providing top-tier protection services for high-risk environments.,Set,False,Indirect Services and Materials,Facility Services,Security Services,Manned Guarding
,GreenPower Energy Solutions,Optimize your energy usage to reduce costs and enhance sustainability.,KG,True,Indirect Services and Materials,Facility Services,Real Estate & Utilities,Energy Management & Sustainability Services
,GreenPower Energy Solutions,Maximize your energy efficiency and reduce carbon footprint with our comprehensive sustainability services.,Piece,False,Indirect Services and Materials,Facility Services,Real Estate & Utilities,Energy Management & Sustainability Services
,ProEvent Solutions,"A comprehensive event management platform offering seamless coordination, innovative solutions, and top-notch production services.",KG,False,Indirect Services and Materials,Marketing & Sales,Events & Promotions,Event Management & Production
,FreshBite Catering Solutions,"Offering fresh, customizable meal options and beverages that cater to any event or gathering.",Box,False,Indirect Services and Materials,Facility Services,Office Supplies & Services,Catering & Vending Services
,FreshBite Catering,"Providing fresh and healthy catering options for various events, ensuring your guests enjoy delicious meals made to order.",Box,False,Indirect Services and Materials,Facility Services,Office Supplies & Services,Catering & Vending Services
,SleekTech Pro Laptop,A powerful and sleek laptop designed for both work and entertainment.,Piece,False,Indirect Services and Materials,IT & Technology,Hardware,"End-User Computing (Laptops, Desktops, Monitors)"
,InsightPro Analytics Suite,A comprehensive platform offering advanced data analysis and visualization tools to help businesses make informed decisions.,Box,False,Indirect Services and Materials,Marketing & Sales,Market Research,"Data, Surveys & Analysis"
,Global Travel Solutions,A leading travel management company offering comprehensive services to ensure seamless and cost-effective travel experiences for individuals and businesses alike.,KG,False,Indirect Services and Materials,Corporate Travel,Travel Management Services,Travel Management Companies (TMCs)
,SeaLink Maritime Solutions,A comprehensive suite of air and ocean freight services designed to optimize global logistics.,Set,False,Indirect Services and Materials,Logistics,Transportation & Freight,Air & Ocean Freight
,CloudSecure Pro,A robust cloud security solution providing advanced protection against cyber threats and data breaches.,KG,False,Indirect Services and Materials,IT & Technology,IT Services & Telecom,"Cloud & Hosting (IaaS, PaaS, SaaS)"
,EcoFlow Energy Monitor,A smart device that tracks and optimizes your energy consumption to reduce waste and save money.,Set,True,Indirect Services and Materials,Facility Services,Real Estate & Utilities,"Utilities (Gas, Electricity, Water)"
,Leadership Enhancement Program,An immersive online course designed to develop essential leadership skills and strategies for effective team management.,Piece,False,Indirect Services and Materials,Corporate & Professional Services,Human Resources Services,Training & Development
,SecureGuard Pro Firewall,Advanced firewall solution designed to protect your network from cyber threats while ensuring optimal performance.,Box,False,Indirect Services and Materials,IT & Technology,Hardware,"Networking (Routers, Switches, Firewalls)"
,Wellness Wednesday,"A monthly subscription offering personal wellness workshops, stress management sessions, and community service opportunities to boost employee well-being.",Piece,False,Indirect Services and Materials,Corporate & Professional Services,Human Resources Services,Employee Welfare & Assistance Programs
,MarketInsight Pro,A powerful tool that provides deep insights into market trends and customer behaviors through advanced analytics.,Box,True,Indirect Services and Materials,Marketing & Sales,Market Research,Brand Tracking & Analytics
,GreenSight Solutions,Expert environmental consultants providing comprehensive sustainability assessments and innovative solutions to reduce carbon footprint.,Set,False,Indirect Services and Materials,Corporate & Professional Services,Consulting,Environmental & Sustainability Consulting
,Prime Lease Solutions,Offering flexible and comprehensive lease agreements tailored to your property needs.,Set,False,Indirect Services and Materials,Facility Services,Real Estate & Utilities,Property Leases & Rent
,StockFlow Pro,"A comprehensive inventory management system that streamlines stock tracking, automates reorder processes, and provides real-time analytics for optimal supply chain efficiency.",Piece,False,Indirect Services and Materials,Logistics,Warehousing & Distribution,Inventory Management Systems
,FlexDrive Lease,"Tailor-made leasing options for personal or business use, ensuring flexibility and competitive rates.",KG,True,Indirect Services and Materials,Logistics,Fleet Management,Vehicle Leasing & Purchase
,SecureVault Storage,A state-of-the-art warehouse offering climate-controlled units and 24/7 security.,Box,False,Indirect Services and Materials,Logistics,Warehousing & Distribution,Warehouse Rental & Storage
,EcoNote Premium Notebook,High-quality notebook made from sustainable materials for your daily notes and reflections.,Box,True,Indirect Services and Materials,Facility Services,Office Supplies & Services,Stationery & Consumables
,SecureForce Patrol,Professional security personnel providing real-time protection and monitoring services.,Piece,False,Indirect Services and Materials,Facility Services,Security Services,Manned Guarding
,DocuSecure,A secure cloud-based platform for managing and organizing your important documents while ensuring maximum protection against unauthorized access.,Set,False,Indirect Services and Materials,Facility Services,Office Supplies & Services,Mail & Document Management
,Sales Star Program,An innovative sales incentive program designed to boost team morale and productivity through rewarding top performers.,Box,False,Indirect Services and Materials,Marketing & Sales,Sales Support,Sales Incentive & Reward Programs
,ProCar Diagnostics Kit,A comprehensive toolset for diagnosing engine issues and ensuring optimal vehicle performance.,KG,True,Indirect Services and Materials,Logistics,Fleet Management,Vehicle Maintenance & Repair
,AirGuard Pro,A high-efficiency air purification system designed to maintain clean indoor air quality while complementing your HVAC systems.,KG,False,Indirect Services and Materials,Facility Services,Facility Management,Building Maintenance & HVAC
