sku,name,description,unitOfMeasure,isCritical,category_L1,category_L2,category_L3,category_L4
,FleetGuard Pro,"A comprehensive telematics solution designed to monitor vehicle performance, driver behavior, and route optimization for efficient fleet management.",KG,False,Indirect Services and Materials,Logistics,Fleet Management,Telematics & Fleet Tracking
,CopierPro Premium,A high-performance copier service offering reliable printing and scanning solutions for businesses.,Piece,True,Indirect Services and Materials,Facility Services,Office Supplies & Services,Print & Copy Services
,Secure Space Storage,A secure warehouse rental offering climate-controlled units and 24/7 surveillance.,KG,True,Indirect Services and Materials,Logistics,Warehousing & Distribution,Warehouse Rental & Storage
,SalesConnect Pro,An intuitive CRM tool designed to streamline sales processes and enhance customer interactions.,Piece,False,Indirect Services and Materials,Marketing & Sales,Sales Support,Customer Relationship Management (CRM) Tools
,ExpressShip Pro,"A premium courier service offering fast, secure delivery solutions for time-sensitive shipments.",Set,False,Indirect Services and Materials,Logistics,Transportation & Freight,Parcel & Courier Services
,SalesForce CRM Pro,A comprehensive CRM solution designed to streamline sales processes and enhance customer engagement.,Set,False,Indirect Services and Materials,Marketing & Sales,Sales Support,Customer Relationship Management (CRM) Tools
,HyperX Pro Rack Server,High-performance rack server designed for demanding data center workloads.,Set,True,Indirect Services and Materials,IT & Technology,Hardware,"Data Center (Servers, Storage)"
,SocialSavvy,A comprehensive toolset designed to optimize influencer campaigns and elevate social media marketing strategies.,Set,False,Indirect Services and Materials,Marketing & Sales,Marketing & Advertising,Influencer & Social Media Marketing
,Legal Compliance Toolkit,A comprehensive software solution designed to streamline compliance processes and minimize legal risks for businesses.,KG,False,Indirect Services and Materials,Corporate & Professional Services,Legal Services,Corporate & Commercial Law
,FleetTrack Pro,"A comprehensive telematics solution that provides real-time fleet tracking, driver behavior analytics, and advanced reporting for efficient fleet management.",Set,True,Indirect Services and Materials,Logistics,Fleet Management,Telematics & Fleet Tracking
,DriveSmart Lease,Affordable and flexible vehicle leasing options designed to fit your lifestyle.,Piece,False,Indirect Services and Materials,Logistics,Fleet Management,Vehicle Leasing & Purchase
,OptiMight Pro Laptop,A powerful laptop designed to handle intensive tasks and multitasking with ease.,Set,True,Indirect Services and Materials,IT & Technology,Hardware,"End-User Computing (Laptops, Desktops, Monitors)"
,Global Impact Alliance,A platform that connects socially responsible organizations to create impactful and sustainable partnerships.,Piece,False,Indirect Services and Materials,Marketing & Sales,Marketing & Advertising,Sponsorships & Partnerships
,Strategic Edge Solutions,Unlock your organization's full potential through innovative management and strategy consulting services.,KG,False,Indirect Services and Materials,Corporate & Professional Services,Consulting,Management & Strategy Consulting
,SecureGuard Cyber Defense,"A comprehensive suite of cybersecurity services including penetration testing, real-time monitoring, and a dedicated Security Operations Center (SOC).",Piece,False,Indirect Services and Materials,IT & Technology,IT Services & Telecom,"Cybersecurity Services (Pen Testing, Monitoring, SOC)"
,Express Rail Connect,A high-speed rail service connecting major cities with unparalleled comfort and reliability.,Box,False,Indirect Services and Materials,Corporate Travel,Transportation,Rail Services
,All-In-One Home Protection Plan,"Comprehensive coverage that combines property protection, liability coverage, health benefits, and travel insurance for a seamless safety net.",Set,False,Indirect Services and Materials,Corporate & Professional Services,Financial Services,"Insurance (Property, Liability, Health, Travel)"
,SecureGuard Pro,State-of-the-art access control system ensuring secure entry and exit points for enhanced safety.,Box,False,Indirect Services and Materials,Facility Services,Security Services,Access Control Systems
,Eco-Friendly Water Bottle,Stylish and sustainable water bottle perfect for promoting your brand at outdoor events.,KG,False,Indirect Services and Materials,Marketing & Sales,Events & Promotions,Promotional Goods & Branded Merchandise
,AdMaster Pro,"An advanced platform offering comprehensive media buying solutions across various channels including print, broadcast, and digital.",KG,True,Indirect Services and Materials,Marketing & Sales,Marketing & Advertising,"Media Buying (Print, Broadcast, Digital)"
,CloudFlex Pro,A scalable cloud hosting solution that seamlessly integrates IaaS and PaaS capabilities for optimal performance and flexibility.,KG,False,Indirect Services and Materials,IT & Technology,IT Services & Telecom,"Cloud & Hosting (IaaS, PaaS, SaaS)"
,DocuSecure Pro,"A secure cloud-based solution for managing, organizing and sharing your sensitive documents.",Box,False,Indirect Services and Materials,Facility Services,Office Supplies & Services,Mail & Document Management
,StaffFlow Solutions,Streamline your recruitment process and manage staffing needs efficiently with our cutting-edge tools.,Piece,False,Indirect Services and Materials,Corporate & Professional Services,Human Resources Services,"Recruitment & Staffing (Permanent, Temporary)"
,CAD Master Pro,A powerful CAD software solution that streamlines engineering and design processes for professionals.,Set,True,Indirect Services and Materials,IT & Technology,Software,"Engineering & Design (CAD, PLM)"
,ExpressCargo Truck,A high-performance road freight truck designed for efficient and reliable delivery of goods.,Set,False,Indirect Services and Materials,Logistics,Transportation & Freight,"Road Freight (FTL, LTL)"
,Global Logistics Solutions,A comprehensive freight forwarding and customs brokerage service ensuring seamless international trade operations.,Set,False,Indirect Services and Materials,Logistics,Transportation & Freight,Freight Forwarding & Customs Brokerage
,SEO Boost Pro,A comprehensive tool to enhance your website's search engine ranking and visibility.,Box,False,Indirect Services and Materials,Marketing & Sales,Marketing & Advertising,Digital Marketing & SEO/SEM
,SpeedyNet Pro,High-speed internet solution designed to optimize your network performance and enhance connectivity.,KG,True,Indirect Services and Materials,IT & Technology,IT Services & Telecom,"Telecommunications (Mobile, Fixed Line, Internet)"
,Leadership Mastery Course,This course offers practical insights and strategies to enhance leadership skills through interactive sessions and real-world case studies.,Box,False,Indirect Services and Materials,Corporate & Professional Services,Human Resources Services,Training & Development
,MasterClass Certification Program,A comprehensive training program designed to enhance skills and knowledge through interactive sessions and expert-led workshops.,Set,False,Indirect Services and Materials,Corporate & Professional Services,Human Resources Services,Training & Development
,Global Delivery Solutions,Comprehensive third-party logistics services that optimize your supply chain operations and enhance delivery efficiency.,KG,True,Indirect Services and Materials,Logistics,Warehousing & Distribution,3rd Party Logistics (3PL) Services
,JobMatch Pro,An advanced platform connecting employers with top talent tailored to their specific needs.,KG,False,Indirect Services and Materials,Corporate & Professional Services,Human Resources Services,"Recruitment & Staffing (Permanent, Temporary)"
,SecureGuard Pro,"A comprehensive home security system featuring advanced motion detection, remote monitoring, and real-time alerts.",Piece,False,Indirect Services and Materials,Facility Services,Security Services,Alarm Systems & Monitoring
,Global Express Freight Solutions,"Offering comprehensive logistics services including warehousing, transportation, and distribution to meet your business needs.",Piece,False,Indirect Services and Materials,Logistics,Warehousing & Distribution,3rd Party Logistics (3PL) Services
,EcoClean Pro,A state-of-the-art waste management system that simplifies recycling and reduces landfill impact.,Set,True,Indirect Services and Materials,Facility Services,Real Estate & Utilities,Waste Management & Recycling
,GlobalOcean Air Transport,Efficient global logistics solutions connecting ports to airports seamlessly.,Box,False,Indirect Services and Materials,Logistics,Transportation & Freight,Air & Ocean Freight
,PowerSave Pro,A cutting-edge fuel card management system designed to optimize your business's fuel expenses and enhance operational efficiency.,Set,False,Indirect Services and Materials,Logistics,Fleet Management,"Fuel, Fuel Cards & Management"
,SecureVault Pro,A cutting-edge online banking solution designed to provide unmatched security and seamless financial management.,Box,False,Indirect Services and Materials,Corporate & Professional Services,Financial Services,Banking & Treasury Services
,ProcessFlow Optimizer,A comprehensive software solution designed to streamline operations and enhance process efficiency across various business functions.,Piece,True,Indirect Services and Materials,Corporate & Professional Services,Consulting,Operations & Process Improvement
,SpeedBoost Mobile,A high-speed mobile internet plan offering unlimited data and global roaming capabilities.,Piece,False,Indirect Services and Materials,IT & Technology,IT Services & Telecom,"Telecommunications (Mobile, Fixed Line, Internet)"
,GreenPath Solutions,A comprehensive environmental consulting firm dedicated to sustainable practices and innovative solutions.,Set,False,Indirect Services and Materials,Corporate & Professional Services,Consulting,Environmental & Sustainability Consulting
,Eco-Friendly Wireless Mouse,A sleek and ergonomic wireless mouse designed to enhance your productivity while reducing environmental impact.,Set,True,Indirect Services and Materials,IT & Technology,Hardware,"Peripherals & Accessories (Printers, Keyboards)"
,StockFlow Pro,"A comprehensive inventory management system designed to streamline stock tracking, automate reorder processes, and enhance overall supply chain efficiency.",Piece,False,Indirect Services and Materials,Logistics,Warehousing & Distribution,Inventory Management Systems
,EchoPro X3000 4K Ultra HD Projector,Delivers stunningly clear and vibrant images for any multimedia presentation or home theater experience.,Piece,False,Indirect Services and Materials,IT & Technology,Hardware,"Audio/Visual Equipment (Projectors, Conferencing Systems)"
,DataInsight Pro,A powerful Business Intelligence tool that transforms complex data into actionable insights through advanced analytics and real-time visualization.,Box,False,Indirect Services and Materials,IT & Technology,Software,"Business Intelligence & Analytics (BI, Data Visualization)"
,OceanGuard Logistics,A comprehensive solution offering secure and efficient shipping services across air and ocean routes.,Box,False,Indirect Services and Materials,Logistics,Transportation & Freight,Air & Ocean Freight
,FreshBite Catering,"Serving fresh, healthy meals and beverages tailored to your event's needs.",Piece,False,Indirect Services and Materials,Facility Services,Office Supplies & Services,Catering & Vending Services
,SecurePay Pro,"A cutting-edge payment processing solution that ensures fast, secure transactions and advanced fraud detection.",Box,False,Indirect Services and Materials,Corporate & Professional Services,Financial Services,Payment Processing
,ExpressCargo Fleet,A premier road freight service offering both FTL and LTL shipping solutions tailored to meet diverse business logistics needs.,Set,False,Indirect Services and Materials,Logistics,Transportation & Freight,"Road Freight (FTL, LTL)"
,StockMaster Pro,"An advanced inventory management system designed to streamline stock tracking, optimize purchasing processes, and enhance overall operational efficiency.",Piece,False,Indirect Services and Materials,Logistics,Warehousing & Distribution,Inventory Management Systems
,ExpoPro Display Solutions,Professional-grade trade show booths designed to attract attention and showcase your brand effectively.,Set,False,Indirect Services and Materials,Marketing & Sales,Events & Promotions,Trade Show & Exhibition Services
,ServerX Pro,A powerful server solution designed to optimize performance and scalability for modern data centers.,Piece,False,Indirect Services and Materials,IT & Technology,Hardware,"Data Center (Servers, Storage)"
,RailGuard Pro,A comprehensive safety system designed to enhance passenger protection on train platforms.,Box,True,Indirect Services and Materials,Corporate Travel,Transportation,Rail Services
,CadMaster Pro,A comprehensive CAD tool designed to streamline engineering workflows and enhance design accuracy.,Set,True,Indirect Services and Materials,IT & Technology,Software,"Engineering & Design (CAD, PLM)"
,CostGuard Pro,Automate your expense tracking and budget management with advanced reporting features.,Box,False,Indirect Services and Materials,Corporate Travel,Travel Management Services,Expense Management Software
,ExpoPro Solutions,"A comprehensive trade show service provider offering innovative exhibition design, logistics management, and interactive exhibit solutions.",Piece,False,Indirect Services and Materials,Marketing & Sales,Events & Promotions,Trade Show & Exhibition Services
,DocuGuard Pro,"A robust cloud-based solution that securely manages your documents and emails, ensuring data privacy and accessibility.",Box,True,Indirect Services and Materials,Facility Services,Office Supplies & Services,Mail & Document Management
,MediaMax Pro,"A comprehensive media buying platform that offers optimized solutions across print, broadcast, and digital channels to maximize your advertising reach.",Piece,True,Indirect Services and Materials,Marketing & Sales,Marketing & Advertising,"Media Buying (Print, Broadcast, Digital)"
,SecureGuard Pro,A state-of-the-art alarm system that monitors your home or office and provides real-time alerts to keep you safe.,Box,False,Indirect Services and Materials,Facility Services,Security Services,Alarm Systems & Monitoring
,Strategic Growth Catalyst,A comprehensive consulting service designed to optimize business growth through innovative strategies and actionable insights.,KG,False,Indirect Services and Materials,Corporate & Professional Services,Consulting,Management & Strategy Consulting
,Eco-Friendly Bamboo Water Bottle,Stylish and sustainable water bottle perfect for any eco-conscious individual.,Piece,False,Indirect Services and Materials,Marketing & Sales,Events & Promotions,Promotional Goods & Branded Merchandise
,Comprehensive Financial Advisory,Expert guidance on optimizing your financial strategy and ensuring compliance with all tax regulations.,Set,False,Indirect Services and Materials,Corporate & Professional Services,Financial Services,"Audit, Tax & Advisory Services"
,Global Visa Express,A comprehensive service offering expert guidance on visa applications and immigration processes worldwide.,Piece,False,Indirect Services and Materials,Corporate Travel,Travel Management Services,Visa & Immigration Support
,GardenPro Propane Tank,A durable propane tank designed to provide reliable fuel for outdoor equipment and appliances.,Set,False,Indirect Services and Materials,Facility Services,Facility Management,Landscaping & Groundskeeping
,SalesForce Pro,An advanced CRM tool designed to streamline sales processes and enhance customer engagement.,Piece,True,Indirect Services and Materials,Marketing & Sales,Sales Support,Customer Relationship Management (CRM) Tools
,SalaryPro Payroll Suite,Streamlines payroll processing and benefits administration for businesses of all sizes.,Piece,False,Indirect Services and Materials,Corporate & Professional Services,Human Resources Services,Payroll & Benefits Administration
,BrandInsight Pro,A comprehensive tool that leverages advanced analytics to monitor brand performance and consumer sentiment across multiple platforms.,Set,False,Indirect Services and Materials,Marketing & Sales,Market Research,Brand Tracking & Analytics
,Flexi Lease Pro,A flexible lease management system designed to simplify rental agreements and enhance tenant satisfaction.,Piece,False,Indirect Services and Materials,Facility Services,Real Estate & Utilities,Property Leases & Rent
,LeaseLink Motor Solutions,Offering flexible leasing options and tailored purchase plans to fit your lifestyle.,Piece,False,Indirect Services and Materials,Logistics,Fleet Management,Vehicle Leasing & Purchase
,ProVision Ultra HD Projector,A high-resolution projector ideal for conference rooms and presentations.,Set,False,Indirect Services and Materials,IT & Technology,Hardware,"Audio/Visual Equipment (Projectors, Conferencing Systems)"
,HirePro,A comprehensive recruitment platform offering permanent and temporary staffing solutions tailored to meet diverse business needs.,Set,False,Indirect Services and Materials,Corporate & Professional Services,Human Resources Services,"Recruitment & Staffing (Permanent, Temporary)"
,CostGuard Pro,"An advanced expense management software that simplifies tracking, categorizing, and approving expenses to enhance financial control and reduce overhead costs.",Set,False,Indirect Services and Materials,Corporate Travel,Travel Management Services,Expense Management Software
,Premier Lease Assurance,A comprehensive lease protection service that ensures your rental property is fully compliant and safeguarded.,Piece,False,Indirect Services and Materials,Facility Services,Real Estate & Utilities,Property Leases & Rent
,StreamlineFlow,"A comprehensive tool designed to optimize workflows, reduce bottlenecks, and enhance operational efficiency.",KG,True,Indirect Services and Materials,Corporate & Professional Services,Consulting,Operations & Process Improvement
,Optima IT Support,"Comprehensive managed services including helpdesk support, network management, and proactive monitoring to ensure your business stays secure and operational.",Piece,False,Indirect Services and Materials,IT & Technology,IT Services & Telecom,"Managed Services (Helpdesk, Network Management)"
,CloudCore Pro Server,A high-performance server designed to optimize data storage and processing capabilities for modern cloud environments.,Piece,False,Indirect Services and Materials,IT & Technology,Hardware,"Data Center (Servers, Storage)"
,CloudCare Pro,A comprehensive managed services solution offering helpdesk support and network management to enhance business productivity.,Piece,False,Indirect Services and Materials,IT & Technology,IT Services & Telecom,"Managed Services (Helpdesk, Network Management)"
,LogiMate Solutions,Comprehensive third-party logistics services to streamline your supply chain operations efficiently.,Set,False,Indirect Services and Materials,Logistics,Warehousing & Distribution,3rd Party Logistics (3PL) Services
,Eco-Friendly Reusable Notebook,"A durable, eco-friendly notebook made from recycled paper that promotes sustainability and offers ample space for notes.",Set,True,Indirect Services and Materials,Facility Services,Office Supplies & Services,Stationery & Consumables
,PatentPro Advisor,"A comprehensive software solution that guides inventors through the patent application process, ensuring compliance and maximizing intellectual property protection.",Set,False,Indirect Services and Materials,Corporate & Professional Services,Legal Services,Intellectual Property & Patents
,Global Visa Express,A comprehensive visa application service that ensures timely submission and expert assistance to navigate complex immigration processes.,Piece,False,Indirect Services and Materials,Corporate Travel,Travel Management Services,Visa & Immigration Support
,Global Logistics Solutions,"Comprehensive logistics services including warehousing, transportation, and inventory management for businesses of all sizes.",Set,True,Indirect Services and Materials,Logistics,Warehousing & Distribution,3rd Party Logistics (3PL) Services
,RentMaster Pro,An all-in-one platform to streamline property lease agreements and rent collection processes.,Piece,False,Indirect Services and Materials,Facility Services,Real Estate & Utilities,Property Leases & Rent
,EcoPower Optimizer,A comprehensive energy management solution that enhances efficiency and reduces carbon footprint through smart analytics and automated controls.,KG,False,Indirect Services and Materials,Facility Services,Real Estate & Utilities,Energy Management & Sustainability Services
,SmartStock Pro,"A comprehensive inventory management system designed to streamline operations, reduce costs, and improve stock accuracy.",Set,False,Indirect Services and Materials,Logistics,Warehousing & Distribution,Inventory Management Systems
,BrightView Apartment,Modern apartments offering spacious living areas and premium amenities for your stay.,KG,False,Indirect Services and Materials,Facility Services,Real Estate & Utilities,Property Leases & Rent
,Eco-Friendly Stress Ball,"A durable, stress-relieving ball made from recycled materials that promotes sustainability.",KG,False,Indirect Services and Materials,Marketing & Sales,Events & Promotions,Promotional Goods & Branded Merchandise
